{
  "$schema": "http://json-schema.org/draft-07/schema#",
  "$id": "https://github.com/Galvnyz/CheckID/data/frameworks.schema.json",
  "title": "Framework Metadata",
  "description": "Schema for framework metadata files under data/frameworks/. Each *.json file in that directory describes how a single compliance framework is rendered, scored, and identified in the CheckID registry. The schema lives outside data/frameworks/ to mirror the data/registry.schema.json convention and to keep the Pester enumerator (Get-ChildItem data/frameworks/*.json) focused on framework files.",
  "type": "object",
  "required": [
    "frameworkId",
    "label",
    "version",
    "description",
    "homepageUrl",
    "css",
    "totalControls",
    "registryKey",
    "csvColumn",
    "displayOrder",
    "scoring"
  ],
  "additionalProperties": true,
  "properties": {
    "frameworkId": {
      "type": "string",
      "pattern": "^[a-z0-9][a-z0-9-]*[a-z0-9]$",
      "description": "Stable lowercase-kebab identifier. Must match the filename stem."
    },
    "label": {
      "type": "string",
      "minLength": 1,
      "description": "Human-readable framework name shown in UI."
    },
    "version": {
      "type": "string",
      "minLength": 1,
      "description": "Framework version string (e.g., '6.0.1', 'R2', 'v10', '2022')."
    },
    "description": {
      "type": "string",
      "minLength": 20,
      "description": "One- or two-sentence description of the framework's purpose."
    },
    "homepageUrl": {
      "type": "string",
      "format": "uri",
      "description": "Authoritative source URL for the framework."
    },
    "css": {
      "type": "string",
      "pattern": "^fw-[a-z0-9-]+$",
      "description": "CSS class prefix used by consumers for framework-specific styling."
    },
    "totalControls": {
      "type": "integer",
      "minimum": 1,
      "description": "Total count of controls/practices/techniques in the framework."
    },
    "registryKey": {
      "type": "string",
      "minLength": 1,
      "description": "Key used in registry.json check entries to reference this framework."
    },
    "csvColumn": {
      "type": "string",
      "minLength": 1,
      "description": "Column header in framework-mappings.csv that holds this framework's mapping."
    },
    "displayOrder": {
      "type": "integer",
      "minimum": 0,
      "description": "Sort order for UI rendering (lower = earlier)."
    },
    "scoring": {
      "type": "object",
      "required": ["method"],
      "additionalProperties": true,
      "properties": {
        "method": {
          "type": "string",
          "enum": [
            "profile-compliance",
            "control-coverage",
            "maturity-level",
            "criteria-coverage",
            "technique-coverage",
            "requirement-compliance",
            "function-coverage",
            "policy-compliance",
            "severity-coverage"
          ],
          "description": "Scoring strategy. Method-specific fields (profiles, maturityLevels, criteria, tactics, requirements, functions, policies, severities) are permitted via additionalProperties."
        }
      }
    },
    "colors": {
      "$ref": "#/definitions/colorTheme",
      "description": "Optional top-level light/dark theme colors. Some frameworks (CIS) declare colors per scoring profile instead."
    },
    "groupBy": {
      "type": "string",
      "enum": [
        "section-prefix",
        "dot-prefix",
        "family-letter-prefix",
        "soc2-tsc-prefix",
        "essential-eight-practice",
        "scuba-service",
        "hipaa-section",
        "article-prefix",
        "nist-800-171-family"
      ],
      "description": "Render-taxonomy strategy: names the parser a consumer applies to a controlId to derive its group key. Pairs with 'groups' (or the 'sections'/'controls' variants). Omit when the framework has no native grouping axis and declare 'taxonomyDecision' instead."
    },
    "groupLabel": {
      "type": "string",
      "minLength": 1,
      "description": "Singular noun for one group under this framework's axis (e.g. 'section', 'family', 'clause', 'article', 'service')."
    },
    "groups": {
      "$ref": "#/definitions/groupMap",
      "description": "controlId-prefix -> display label, per the 'groupBy' strategy. Must cover every prefix produced from registry.json controlIds (enforced by tests/framework-grouping-coverage.Tests.ps1)."
    },
    "sections": {
      "$ref": "#/definitions/groupMap",
      "description": "Variant of 'groups' used by CIS section-numbered frameworks (e.g. cis-m365-v6). Same shape and coverage contract."
    },
    "controls": {
      "$ref": "#/definitions/groupMap",
      "description": "Variant of 'groups' used by CIS Controls v8 (top-level control families). Same shape and coverage contract."
    },
    "taxonomyDecision": {
      "type": "string",
      "enum": ["domain-fallback"],
      "description": "Declared when a framework intentionally has no native grouping axis. 'domain-fallback' tells consumers to group by the M365-Assess product domain instead. Pairs with 'taxonomyReason'."
    },
    "taxonomyReason": {
      "type": "string",
      "minLength": 1,
      "description": "Human-readable justification for a 'taxonomyDecision' — why no native axis is provided and how to enable one later."
    }
  },
  "definitions": {
    "groupMap": {
      "type": "object",
      "minProperties": 1,
      "additionalProperties": {
        "type": "string",
        "minLength": 1
      },
      "description": "Map of controlId-prefix (string key) to human-readable display label."
    },
    "colorTheme": {
      "type": "object",
      "required": ["light", "dark"],
      "additionalProperties": false,
      "properties": {
        "light": { "$ref": "#/definitions/colorPair" },
        "dark": { "$ref": "#/definitions/colorPair" }
      }
    },
    "colorPair": {
      "type": "object",
      "required": ["background", "color"],
      "additionalProperties": false,
      "properties": {
        "background": {
          "type": "string",
          "pattern": "^#[0-9A-Fa-f]{6}$"
        },
        "color": {
          "type": "string",
          "pattern": "^#[0-9A-Fa-f]{6}$"
        }
      }
    }
  }
}
